<?xml version="1.0" encoding="UTF-8"?>
<tns:domain xmlns:tns="www.xseam.org/schemas/Domain"
	xmlns:xsi="http://www.w3.org/2001/XMLSchema-instance"
	xsi:schemaLocation="www.xseam.org/schemas/Domain ../Domain.xsd ">
	<domain id="2600054" description="Abreu e Lima" />
	<domain id="2600104" description="Afogados da Ingazeira" />
	<domain id="2600203" description="Afrânio" />
	<domain id="2600302" description="Agrestina" />
	<domain id="2600401" description="Água Preta" />
	<domain id="2600500" description="Águas Belas" />
	<domain id="2600609" description="Alagoinha" />
	<domain id="2600708" description="Aliança" />
	<domain id="2600807" description="Altinho" />
	<domain id="2600906" description="Amaraji" />
	<domain id="2601003" description="Angelim" />
	<domain id="2601052" description="Araçoiaba" />
	<domain id="2601102" description="Araripina" />
	<domain id="2601201" description="Arcoverde" />
	<domain id="2601300" description="Barra de Guabiraba" />
	<domain id="2601409" description="Barreiros" />
	<domain id="2601508" description="Belém de Maria" />
	<domain id="2601607" description="Belém de São Francisco" />
	<domain id="2601706" description="Belo Jardim" />
	<domain id="2601805" description="Betânia" />
	<domain id="2601904" description="Bezerros" />
	<domain id="2602001" description="Bodocó" />
	<domain id="2602100" description="Bom Conselho" />
	<domain id="2602209" description="Bom Jardim" />
	<domain id="2602308" description="Bonito" />
	<domain id="2602407" description="Brejão" />
	<domain id="2602506" description="Brejinho" />
	<domain id="2602605" description="Brejo da Madre de Deus" />
	<domain id="2602704" description="Buenos Aires" />
	<domain id="2602803" description="Buíque" />
	<domain id="2602902" description="Cabo de Santo Agostinho" />
	<domain id="2603009" description="Cabrobó" />
	<domain id="2603108" description="Cachoeirinha" />
	<domain id="2603207" description="Caetés" />
	<domain id="2603306" description="Calçado" />
	<domain id="2603405" description="Calumbi" />
	<domain id="2603454" description="Camaragibe" />
	<domain id="2603504" description="Camocim de São Félix" />
	<domain id="2603603" description="Camutanga" />
	<domain id="2603702" description="Canhotinho" />
	<domain id="2603801" description="Capoeiras" />
	<domain id="2603900" description="Carnaíba" />
	<domain id="2603926" description="Carnaubeira da Penha" />
	<domain id="2604007" description="Carpina" />
	<domain id="2604106" description="Caruaru" />
	<domain id="2604155" description="Casinhas" />
	<domain id="2604205" description="Catende" />
	<domain id="2604304" description="Cedro" />
	<domain id="2604403" description="Chã de Alegria" />
	<domain id="2604502" description="Chã Grande" />
	<domain id="2604601" description="Condado" />
	<domain id="2604700" description="Correntes" />
	<domain id="2604809" description="Cortês" />
	<domain id="2604908" description="Cumaru" />
	<domain id="2605004" description="Cupira" />
	<domain id="2605103" description="Custódia" />
	<domain id="2605152" description="Dormentes" />
	<domain id="2605202" description="Escada" />
	<domain id="2605301" description="Exu" />
	<domain id="2605400" description="Feira Nova" />
	<domain id="2605459" description="Fernando de Noronha" />
	<domain id="2605509" description="Ferreiros" />
	<domain id="2605608" description="Flores" />
	<domain id="2605707" description="Floresta" />
	<domain id="2605806" description="Frei Miguelinho" />
	<domain id="2605905" description="Gameleira" />
	<domain id="2606002" description="Garanhuns" />
	<domain id="2606101" description="Glória do Goitá" />
	<domain id="2606200" description="Goiana" />
	<domain id="2606309" description="Granito" />
	<domain id="2606408" description="Gravatá" />
	<domain id="2606507" description="Iati" />
	<domain id="2606606" description="Ibimirim" />
	<domain id="2606705" description="Ibirajuba" />
	<domain id="2606804" description="Igarassu" />
	<domain id="2606903" description="Iguaraci" />
	<domain id="2607604" description="Ilha de Itamaracá" />
	<domain id="2607000" description="Inajá" />
	<domain id="2607109" description="Ingazeira" />
	<domain id="2607208" description="Ipojuca" />
	<domain id="2607307" description="Ipubi" />
	<domain id="2607406" description="Itacuruba" />
	<domain id="2607505" description="Itaíba" />
	<domain id="2607653" description="Itambé" />
	<domain id="2607703" description="Itapetim" />
	<domain id="2607752" description="Itapissuma" />
	<domain id="2607802" description="Itaquitinga" />
	<domain id="2607901" description="Jaboatão dos Guararapes" />
	<domain id="2607950" description="Jaqueira" />
	<domain id="2608008" description="Jataúba" />
	<domain id="2608057" description="Jatobá" />
	<domain id="2608107" description="João Alfredo" />
	<domain id="2608206" description="Joaquim Nabuco" />
	<domain id="2608255" description="Jucati" />
	<domain id="2608305" description="Jupi" />
	<domain id="2608404" description="Jurema" />
	<domain id="2608453" description="Lagoa do Carro" />
	<domain id="2608503" description="Lagoa do Itaenga" />
	<domain id="2608602" description="Lagoa do Ouro" />
	<domain id="2608701" description="Lagoa dos Gatos" />
	<domain id="2608750" description="Lagoa Grande" />
	<domain id="2608800" description="Lajedo" />
	<domain id="2608909" description="Limoeiro" />
	<domain id="2609006" description="Macaparana" />
	<domain id="2609105" description="Machados" />
	<domain id="2609154" description="Manari" />
	<domain id="2609204" description="Maraial" />
	<domain id="2609303" description="Mirandiba" />
	<domain id="2614303" description="Moreilândia" />
	<domain id="2609402" description="Moreno" />
	<domain id="2609501" description="Nazaré da Mata" />
	<domain id="2609600" description="Olinda" />
	<domain id="2609709" description="Orobó" />
	<domain id="2609808" description="Orocó" />
	<domain id="2609907" description="Ouricuri" />
	<domain id="2610004" description="Palmares" />
	<domain id="2610103" description="Palmeirina" />
	<domain id="2610202" description="Panelas" />
	<domain id="2610301" description="Paranatama" />
	<domain id="2610400" description="Parnamirim" />
	<domain id="2610509" description="Passira" />
	<domain id="2610608" description="Paudalho" />
	<domain id="2610707" description="Paulista" />
	<domain id="2610806" description="Pedra" />
	<domain id="2610905" description="Pesqueira" />
	<domain id="2611002" description="Petrolândia" />
	<domain id="2611101" description="Petrolina" />
	<domain id="2611200" description="Poção" />
	<domain id="2611309" description="Pombos" />
	<domain id="2611408" description="Primavera" />
	<domain id="2611507" description="Quipapá" />
	<domain id="2611533" description="Quixaba" />
	<domain id="2611606" description="Recife" />
	<domain id="2611705" description="Riacho das Almas" />
	<domain id="2611804" description="Ribeirão" />
	<domain id="2611903" description="Rio Formoso" />
	<domain id="2612000" description="Sairé" />
	<domain id="2612109" description="Salgadinho" />
	<domain id="2612208" description="Salgueiro" />
	<domain id="2612307" description="Saloá" />
	<domain id="2612406" description="Sanharó" />
	<domain id="2612455" description="Santa Cruz" />
	<domain id="2612471" description="Santa Cruz da Baixa Verde" />
	<domain id="2612505" description="Santa Cruz do Capibaribe" />
	<domain id="2612554" description="Santa Filomena" />
	<domain id="2612604" description="Santa Maria da Boa Vista" />
	<domain id="2612703" description="Santa Maria do Cambucá" />
	<domain id="2612802" description="Santa Terezinha" />
	<domain id="2612901" description="São Benedito do Sul" />
	<domain id="2613008" description="São Bento do Una" />
	<domain id="2613107" description="São Caitano" />
	<domain id="2613206" description="São João" />
	<domain id="2613305" description="São Joaquim do Monte" />
	<domain id="2613404" description="São José da Coroa Grande" />
	<domain id="2613503" description="São José do Belmonte" />
	<domain id="2613602" description="São José do Egito" />
	<domain id="2613701" description="São Lourenço da Mata" />
	<domain id="2613800" description="São Vicente Ferrer" />
	<domain id="2613909" description="Serra Talhada" />
	<domain id="2614006" description="Serrita" />
	<domain id="2614105" description="Sertânia" />
	<domain id="2614204" description="Sirinhaém" />
	<domain id="2614402" description="Solidão" />
	<domain id="2614501" description="Surubim" />
	<domain id="2614600" description="Tabira" />
	<domain id="2614709" description="Tacaimbó" />
	<domain id="2614808" description="Tacaratu" />
	<domain id="2614857" description="Tamandaré" />
	<domain id="2615003" description="Taquaritinga do Norte" />
	<domain id="2615102" description="Terezinha" />
	<domain id="2615201" description="Terra Nova" />
	<domain id="2615300" description="Timbaúba" />
	<domain id="2615409" description="Toritama" />
	<domain id="2615508" description="Tracunhaém" />
	<domain id="2615607" description="Trindade" />
	<domain id="2615706" description="Triunfo" />
	<domain id="2615805" description="Tupanatinga" />
	<domain id="2615904" description="Tuparetama" />
	<domain id="2616001" description="Venturosa" />
	<domain id="2616100" description="Verdejante" />
	<domain id="2616183" description="Vertente do Lério" />
	<domain id="2616209" description="Vertentes" />
	<domain id="2616308" description="Vicência" />
	<domain id="2616407" description="Vitória de Santo Antão" />
	<domain id="2616506" description="Xexéu" />
</tns:domain>
